text,complexity,domain
Laptop keeps losing WiFi connection every hour or so in building D. Haven't tried anything yet. Just me having the issue. Can someone check AP-BLDG-D-07 or look at my wireless card drivers?,simple,NETWORKING
DNS lookup for external websites failing on my desktop since this morning. Internal sites load fine. My IP address 10.20.1.88 looks correct. No changes made recently. Just needs someone to fix the resolver please,simple,NETWORKING
Firewall blocking my access to our invoicing tool at billing.vendor-x.com — other team members on same floor reach it without any problems. Nothing changed on my machine. Please add an exception or check policy,simple,NETWORKING
VPN connects successfully but disconnects after exactly 60 seconds every single time. Using GlobalProtect client version 5.2.9. Nobody else on my team has this issue. No recent changes on my laptop at all,simple,NETWORKING
Proxy suddenly stopped working for me after a group policy update yesterday. Internet shows no connection. Colleagues on same domain are fine. P1 for my team because I handle time-sensitive vendor payments daily,simple,NETWORKING
DHCP giving my workstation an address from the wrong subnet — getting 172.16.8.0/24 instead of expected 10.30.0.0/24. No troubleshooting attempted. Just noticed when I couldn't access the file server this morning,simple,NETWORKING
SSL cert warning on https://reports.internal.corp — Firefox throwing SEC_ERROR_EXPIRED_CERTIFICATE. Only affects me since colleagues use Edge. Cert clearly expired based on the browser error details. Needs urgent renewal please,simple,NETWORKING
Switch port Gi0/24 on SW-HR-02 went err-disabled after I plugged in my new USB-to-Ethernet adapter. Never had this issue before. No one else affected. Port just needs to be re-enabled and investigated,simple,NETWORKING
NTP configuration on my Windows server WEB-SRV-04 pointing to wrong time source — showing 10.0.99.1 which doesn't exist. Clock drifting badly. No one else affected. Just need correct NTP server address to configure,simple,NETWORKING
NAT seems broken for my laptop only — external internet unreachable but internal resources all work. My colleague at the same desk reaches external sites fine. MAC address 00:1A:2B:3C:4D:5E if that helps debugging,simple,NETWORKING
Port forwarding rule for TCP 5900 pointing to my test machine 10.80.0.30 not passing any traffic. Checked from external network, connection refused. No router changes were made this week. Single developer affected,simple,NETWORKING
Bandwidth on my wired port throttled to roughly 10 Mbps instead of normal gigabit — confirmed with iperf3 test to local server. Cable is fine, swapped it already. Please check switch port SW-OPS-01 Gi1/0/18,simple,NETWORKING
LLDP table on distribution switch DS-MAIN-01 showing no neighbor for my newly installed workstation on port Gi0/5. Port status is up/up. Device definitely supports LLDP. Suspect port misconfiguration from desk move last week,simple,NETWORKING
ACL somewhere is blocking ICMP from my workstation 10.40.0.55 to the monitoring server at 10.40.0.1 — ping fails but HTTP to same host works fine. Nobody else on this VLAN has the problem,simple,NETWORKING
QoS policy question — why is my video conferencing traffic getting worse quality than everyone else on the same call? My machine is at 192.168.10.90. Could DSCP markings be wrong just for my NIC somehow?,simple,NETWORKING
ARP table on router RTR-INET-01 showing my machine's MAC incorrectly — it has an old MAC from my previous NIC. Causing intermittent drops for me. Nobody touched the router config. Just needs ARP entry cleared,simple,NETWORKING
Trunk port between my desk's unmanaged switch and wall jack seems to be causing VLAN issues for me only. Getting access to wrong resources. Colleagues directly plugged into wall jacks are completely fine all day,simple,NETWORKING
Four developers in the DevOps team losing connectivity to the build server at 10.60.0.100 intermittently — happens every 30 minutes for about 2 minutes. Rebooted the build server, issue continued. Network path suspected but not confirmed,moderate,NETWORKING
OSPF adjacency between RTR-DIST-A and RTR-DIST-B dropping and reforming every 40 minutes — "neighbor down: interface down/changed" in logs. Physical interface stays up throughout. MTU both sides 9000, confirmed jumbo frames enabled end-to-end. Cause unclear,moderate,NETWORKING
BGP peer 203.0.113.50 going idle then active twice per day on edge router EDGE-01. Authentication confirmed correct both ends. ISP claims stability on their side. URGENT for management since this is our redundant upstream link,moderate,NETWORKING
DHCP starvation suspected on VLAN 10 — lease count at 248 of 250 with no indication of rogue clients. Seven users unable to obtain addresses since 0800. Reduced lease time to 2 hours as workaround. Root cause unclear,moderate,NETWORKING
DNS secondary server DNS-02 failing to zone-transfer from primary DNS-01 since firewall rules were tightened last Thursday. Five users relying on DNS-02 seeing failures. Confirmed TCP 53 blocked outbound from DNS-01 toward DNS-02,moderate,NETWORKING
Load balancer pool member 10.70.0.15 on VIP 10.70.0.100 continuously failing health checks despite the application responding correctly to manual curl requests. Three users hitting that node getting errors. Suspect health check misconfiguration on the LB itself,moderate,NETWORKING
IPSec tunnel to SITE-PHOENIX failed after ISP IP change on their end — Phase 1 IKE_SA_INIT succeeds but Phase 2 TS negotiation fails with mismatched traffic selectors. Updated crypto ACL on our side to reflect new peer IP but issue persists,moderate,NETWORKING
VPN users in the EMEA group policy — six of them lost access to the 172.31.0.0/16 segment after a split-tunnel config change Monday. Pushed updated profile twice. Three users still affected. Others in same group working fine,moderate,NETWORKING
Proxy PAC file failing to load for five users after the PAC server was migrated to new IP 10.0.5.20 last weekend. WPAD DNS record still pointing at old IP 10.0.5.5. Updating DNS record now but propagation incomplete,moderate,NETWORKING
Spanning tree root bridge elected incorrectly on VLAN 300 after SW-NEW-ACCESS-01 was added — it has lower bridge priority than intended root SW-CORE-01. Corrected priority on SW-NEW-ACCESS-01 but topology not fully reconverged yet across 6 switches,moderate,NETWORKING
SD-WAN application policy on EDGE-SITE-12 sending Salesforce traffic over backup 4G link instead of primary fiber — DIA link showing healthy in orchestrator. Application signature library may be outdated on that specific edge device,moderate,NETWORKING
Packet loss of 12 percent measured via mtr between ACCESS-SW-03 and DIST-SW-01 during morning peak only. Off-hours testing shows zero loss. QoS output queue drops climbing on the Gi uplink. Interface not saturated — below 60 percent utilization,moderate,NETWORKING
MPLS path between sites SITE-BOSTON and SITE-AUSTIN showing 130ms latency instead of contracted 20ms since Friday afternoon. PE-EAST-01 and PE-SOUTH-01 showing clean interfaces. Provider ticket raised Saturday. No resolution update received yet from them,moderate,NETWORKING
PPPoE reconnection loop on router CPE-SITE-06 — session establishes then drops after 90 seconds, cycling continuously. Eight customers on this node affected. RADIUS accepting auth correctly per logs. LCP negotiation completes but IPCP failing with no address offered,moderate,NETWORKING
NTP stratum 2 server NTP-02 orphaned after primary GPS source went offline for maintenance — four application servers drifted beyond 300 seconds. Kerberos starting to reject tickets on those servers specifically. Manually pointed NTP-02 to external pool as temporary fix,moderate,NETWORKING
BGP full table withdrawal from all four upstream providers happened simultaneously at 03:17 UTC — complete internet blackout for 9,200 users. Cleared BGP processes on EDGE-RTR-01 and EDGE-RTR-02 repeatedly, peers not re-establishing. Automation pipeline ran a prefix-list commit at 03:14 — likely culprit, investigating now,complex,NETWORKING
Nexus 9508 spine switch throwing "URIB client not responding" and "RIB table inconsistency" alerts — 4,100 production VMs losing routing intermittently. Tried process restart of urib and ufdm via run bash. Inconsistency persists. Scheduled reload being evaluated but would cause 30-minute production outage,complex,NETWORKING
IPSec hub FW-HUB-01 rejecting IKEv2 auth from all 71 spoke sites since certificate renewal at 0100 — "TS_UNACCEPTABLE: no matching traffic selector" on every branch. Phase 1 completes correctly everywhere. Manually rebuilt tunnel config on two spokes — same failure. Traffic selectors appear identical to working config from last week,complex,NETWORKING
Firewall pair FW-PROD-A and FW-PROD-B both showing active state simultaneously for 11 minutes after config sync failure at 15:02 — asymmetric routing caused 65 percent packet loss to all production services. 4,800 users impacted. Forced FW-PROD-B to standby via console — failover occurred but 340 long-lived sessions dropped,complex,NETWORKING
so the whole data center network is basically looping right now after someone added a switch without telling anyone. spanning tree is going crazy across like 40 VLANs. 2,300 servers unreachable. We've isolated it to building B core but can't find the rogue device yet. Production down 22 minutes,complex,NETWORKING
OSPF backbone area 0 showing 23 routes flapping every 55 seconds across all core routers — 3,800 users experiencing packet loss. MTU verified consistent everywhere. Hello and dead timers confirmed correct. BFD sessions stable throughout. Redistributed static routes from decommissioned segment suspected but filtering changes made two weeks ago,complex,NETWORKING
BGP route leak from CUST-FINANCE VRF into global inet.0 table on PE-RTR-08 — 9,400 prefixes polluting backbone routing table. Loops forming between PE-RTR-08 and PE-RTR-09. Cleared BGP session on PE-RTR-08 twice — leak resumed within 45 seconds. Import policy logic looks correct on paper,complex,NETWORKING
DNS resolver cluster hit by reflection attack — 780 Mbps inbound on resolvers DNS-R01 through DNS-R04. ISP null-routing our /24 announcement. ACLs applied restricting recursion to RFC1918 ranges but external attack traffic still overwhelming uplinks. 5,100 internal users experiencing resolution failures. Anycast route withdrawn temporarily,complex,NETWORKING
SD-WAN control plane went dark across all 103 edge devices after vManage cluster lost quorum during disk failure at node 2 — edges operating on cached policy with traffic engineering frozen. Rebuilt vManage-02, cluster shows healthy but edges refusing to reconnect. Debug shows DTLS certificate mismatch between edges and rebuilt controller,complex,NETWORKING
MPLS LDP label database corrupted on PE-RTR-01 through PE-RTR-04 after simultaneous power event — all label bindings withdrawn. 16 enterprise VPN customers completely offline, roughly 7,100 end users affected. Reloaded PE-RTR-01 and PE-RTR-02 — LDP adjacencies restored but cross-connects for two customers not re-signaling correctly in control plane,complex,NETWORKING
ARP poisoning attack confirmed on VLAN 500 production segment — rogue device at 10.50.0.44 spoofing gateway MAC 00:AA:BB:CC:DD:EE. Dynamic ARP Inspection enabled but DHCP snooping binding table incomplete for this VLAN allowing bypass. 920 hosts potentially affected. Shut the rogue port, but attack resumed from different port 10 minutes later,complex,NETWORKING
QoS Ansible deployment to 95 routers reclassified all EF-marked traffic to AF21 — voice calls and video completely broken network-wide since 0200. Rollback playbook executed successfully per Tower output but show class-map on 78 routers still reflects wrong markings. Attempted manual correction on 12 devices — only 7 took the change correctly,complex,NETWORKING
Load balancer BIGIP-PROD-01 license expired at midnight — all virtual servers entered "license expired" state, dropping all new connections. 3,600 users unable to access any load-balanced application. Uploaded emergency license file via GUI but management interface responding slowly — license activation stuck at 40 percent for 25 minutes,complex,NETWORKING
VLAN 100 removed accidentally from trunk port between CORE-SW-01 and DIST-SW-03 during a routine change — 2,700 users on VLAN 100 lost access to all inter-VLAN resources immediately. Added VLAN 100 back to trunk allowed list on CORE-SW-01 side but DIST-SW-03 still not forwarding — trunk shows VLAN 100 as pruned,complex,NETWORKING
CDP neighborship table completely cleared across all 110 campus switches after upgrading to IOS-XE 17.9.4a — cdp run confirmed enabled globally, cdp enable confirmed on all interfaces, yet zero neighbors populating anywhere. LLDP similarly broken. Rolled back 15 switches to 17.6.5 — CDP returned only on those switches confirming firmware bug,complex,NETWORKING
PPPoE BNG cluster lost redundancy synchronization at 21:40 — BNG-PRIMARY and BNG-BACKUP both active simultaneously, subscriber sessions duplicating and dropping. 2,800 broadband subscribers offline or unstable. Forced BNG-BACKUP into standby, subscriber count partially recovered but 600 sessions still orphaned and not clearing from session table,complex,NETWORKING
ACL pushed to 45 distribution-layer switches via RANCID script last night inadvertently blocked all inter-VLAN routing traffic — deny any any rule inserted at wrong position in the list. 6,500 users across 22 VLANs isolated from each other since 0300. Manual ACL correction completed on 18 switches but 27 still unreachable via SSH,complex,NETWORKING
NTP infrastructure collapsed after GPS-NTP-PRIMARY hardware failure at 0215 — all 14 stratum 2 servers orphaned. Domain-wide clock skew reached 8 minutes by 0615, causing Kerberos authentication failures for all 4,200 domain users. VPN auth also failing. Manually configured 6 stratum 2 servers to use external NTP pool — propagation to clients still lagging,complex,NETWORKING
